{"schema_version":2,"id":"event-inferred","root_id":"root-golden","node":"fixture@host","process":{"physical":{"node":"fixture@host","pid":"<0.2.0>"},"logical":{"id":"worker","label":"worker"},"identity_evidence":[{"kind":"registered_name","value":"worker"}]},"local_instant":{"offset_ns":84,"order":2},"event":{"kind":"send","to":{"node":"fixture@host","pid":"<0.3.0>"},"message":{"kind":"tag","value":"work"},"serial":{"kind":"sequence","previous":6,"current":7}},"evidence":{"kind":"inferred","inference":{"method":"fixture_method_v1","reason":"fixture inference with reproducible inputs","inputs":[{"kind":"event","id":"event-golden"},{"kind":"observation","name":"count","value":"1"},{"kind":"setting","name":"limit","value":"2"}]}}}
